Number,Title
1,' Are women grateful to be here or do women kick ass?' #Sportskongres2020:
2,"""As Black as Ink"": A Case of Alkaptonuria-Associated Myelopathy and a Review of the Literature:"
3,"""Ballistic Six"" Upper-Extremity Plyometric Training for the Pediatric Volleyball Players:"
4,"""beet"" the cold: Beetroot juice supplementation improves peripheral blood flow, endothelial function, and anti-inflammatory status in individuals with Raynaud's phenomenon:"
5,"""found Down"" Compartment Syndrome: Experience from the Front Lines of the Opioid Epidemic:"
6,"""muscle memory"" not mediated by myonuclear number? Secondary analysis of human detraining data:"
7,"""Sit Up Straight"": Time to Re-evaluate:"
8,"""You can't just erase history"": Coping with team identity threat:"
9,#REDS (Relative Energy Deficiency in Sport): Time for a revolution in sports culture and systems to improve athlete health and performance:
10,(Re)conceptualizing institutional change in sport management contexts: the unintended consequences of sport organizations’ everyday organizational life:
11,(Re)examining the effects of athlete brand image (ABI) on psychological commitment: an empirical investigation using structural equation modelling (SEM) and fuzzy set qualitative comparative analysis (fsQCA):
12,‘European-ness’ in social responsibility and sport management research: anchors and avenues:
13,‘Worse than death’ and waiting for a joint arthroplasty:
14,"“Arrogant, ungrateful, anti-American degenerates”: Development and initial validation of the Attitudes Toward Athlete Activism Questionnaire (ATAAQ):"
15,“How are running shoes assessed? A systematic review of characteristics and measurement tools used to describe running footwear”:
16,“If people are wearing pink stuff they're probably not real fans”: Exploring women's perceptions of sport fan clothing:
17,“I'm a completely different person now”: Extraordinary experiences and personal transformations in sport:
18,“I'm just too busy to exercise”: Reframing the negative thoughts associated with exercise-related cognitive errors:
19,"“It's not about sport, it's about you”: An interpretative phenomenological analysis of mentoring elite athletes:"
20,"“Look, Your Muscles Are Firing!”: A Qualitative Study of Clinician Perspectives on the Use of Surface Electromyography in Neurorehabilitation:"
21,“Macro-structure” of developmental participation histories and “micro-structure” of practice of German female world-class and national-class football players:
22,“N-of-1”—Study: A concept of acute and chronic stress research using the example of ballroom dancing:
23,“Postage Stamp” Fractures: A Systematic Review of Patient and Suture Anchor Profiles Causing Anterior Glenoid Rim Fractures After Bankart Repair:
24,“She is where I'd want to be in my career”: Youth athletes’ role models and their implications for career and identity construction:
25,“The process isn't a case of report it and stop”: Athletes’ lived experience of whistleblowing on doping in sport:
26,“The zipper effect”: Exploring the interrelationship of mental toughness and self-compassion among Canadian elite women athletes:
27,“We want more diversity but…”: Resisting diversity in recreational sports clubs:
28,"1.5 mile run time and body mass predict 8 mile loaded march performance, irrespective of sex:"
29,10 years on time–motion and motor actions of paired mixed martial arts athletes:
30,"15 years of the Scandinavian knee ligament registries: lessons, limitations and likely prospects:"
31,1D network simulations for evaluating regional flow and pressure distributions in healthy and asthmatic human lungs:
32,2018 AOA Presidential Address: Developing Leaders and Training Thoroughbreds: AOA Critical Issues:
33,2018 Frank Stinchfield Award: Spinopelvic Hypermobility Is Associated with an Inferior Outcome after THA: Examining the Effect of Spinal Arthrodesis:
34,2018 John Charnley Award: Analysis of US Hip Replacement Bundled Payments: Physician-initiated Episodes Outperform Hospital-initiated Episodes:
35,2018 John N. Insall Award: Recovery of Knee Flexion with Unsupervised Home Exercise Is Not Inferior to Outpatient Physical Therapy after TKA: A Randomized Trial:
36,2019 Chitranjan S. Ranawat Award: Elective joint arthroplasty outcomes improve in malnourished patients with nutritional intervention: A prospective population analysis demonstrates a modifiable risk factor:
37,2019 Frank Stinchfield Award: A comparison of prosthetic joint infection rates between direct anterior and non-anterior approach total hip arthroplasty:
38,2019 ISSLS Wiltse Lifetime Achievement Award:
39,2019 John Charnley Award: Increased risk of prosthetic joint infection following primary total knee and hip arthroplasty with the use of alternative antibiotics to cefazolin:
40,2019 john insall award: Fructosamine is a better glycaemic marker compared with glycated haemoglobin (HbA1C) in predicting adverse outcomes following total knee arthroplasty: A prospective multicentre study:
41,2019 Mark Coventry Award: A multicentre randomized clinical trial of tranexamic acid in revision total knee arthroplasty: Does the dosing regimen matter?:
42,24-h Movement and Nonmovement Behaviors in Older Adults. The IMPACT65+ Study:
43,"30-and 90-Day Unplanned Readmission Rates, Causes, and Risk Factors after Cervical Fusion: A Single-Institution Analysis:"
44,"30-day Mortality Following Surgery for Spinal Epidural Abscess: Incidence, Risk Factors, Predictive Algorithm, and Associated Complications:"
45,3D dSTORM imaging reveals novel detail of ryanodine receptor localization in rat cardiac myocytes:
46,3D strain in native medial meniscus is comparable to medial meniscus allograft transplant:
47,3D-MRI combined with signal-to-noise ratio measurement can improve the diagnostic accuracy and sensitivity in evaluating meniscal healing status after meniscal repair:
48,5-HT2A receptor activation enhances NMDA receptor-mediated glutamate responses through Src kinase in the dendrites of rat jaw-closing motoneurons:
49,5-Year Survival of Pediatric Anterior Cruciate Ligament Reconstruction With Living Donor Hamstring Tendon Grafts:
50,8-Week Basic Military Training Improves Adiponectin Multimer Ratio in Healthy Young Males:
51,90-day Readmission in Elective Primary Lumbar Spine Surgery in the Inpatient Setting: A Nationwide Readmissions Database Sample Analysis:
52,A 10% Increase in Step Rate Improves Running Kinematics and Clinical Outcomes in Runners With Patellofemoral Pain at 4 Weeks and 3 Months:
53,A 11-day compressed overload and taper induces larger physiological improvements than a normal taper in elite cyclists:
54,A 12-year cohort study of DOC-stoppage in professional mixed martial arts:
55,A 14-day recovery and physical activity levels after an ankle sprain in mice:
56,A 2.5?min cold water immersion improves prolonged intermittent sprint performance:
57,A 28-Day Carbohydrate-Restricted Diet Improves Markers of Cardiometabolic Health and Performance in Professional Firefighters:
58,"A 2-Year Prospective Study of Injury Epidemiology in Elite Australian Rugby Sevens: Exploration of Incidence Rates, Severity, Injury Type, and Subsequent Injury in Men and Women:"
59,A 3-arm randomized clinical trial comparing interscalene blockade techniques with local infiltration analgesia for total shoulder arthroplasty:
60,A 4-week multimodal intervention for individuals with chronic ankle instability: Examination of disease-oriented and patient-oriented outcomes:
61,A 6-Week Transition to Maximal Running Shoes Does Not Change Running Biomechanics:
62,A battery of strength tests for evidence-based classification in Para swimming:
63,A bioecological perspective on talent identification in junior-elite soccer: A Pan-European perspective:
64,A Biomechanical Analysis of the Effects of Bouncing the Barbell in the Conventional Deadlift:
65,A biomechanical cadaveric study of patellar tendon allograft as an alternative graft material for superior capsule reconstruction:
66,A Biomechanical Comparison of Alternative Graft Preparations for All-Inside Anterior Cruciate Ligament Reconstruction:
67,A Biomechanical Comparison of Different Suture Materials Used for Arthroscopic Shoulder Procedures:
68,A biomechanical comparison of new techniques for distal clavicular fracture repair versus locked plating:
69,"A Biomechanical Comparison of Single-, Double-, and Triple-Bundle Anterior Cruciate Ligament Reconstructions Using a Hamstring Tendon Graft:"
70,A Biomechanical Comparison of Six Suture Configurations for Soft Tissue–Based Graft Traction and Fixation:
71,A biomechanical comparison of two arthroscopic suture techniques in biceps tenodesis: whip-stitch vs. simple suture techniques:
72,A biomechanical study of headless compression screws versus a locking plate in radial head fracture fixation:
73,A Biomechanical Study of the Role of the Anterolateral Ligament and the Deep Iliotibial Band for Control of a Simulated Pivot Shift With Comparison of Minimally Invasive Extra-articular Anterolateral Tendon Graft Reconstruction Versus Modified Lemaire Reconstruction After Anterior Cruciate Ligament Reconstruction:
74,A brief introduction to health economics:
75,A calcar collar is protective against early periprosthetic femoral fracture around cementless femoral components in primary total hip arthroplasty: A registry study with biomechanical validation:
76,A Case Series of Successful Repair of Articular Cartilage Fragments in the Knee:
77,A Case-control Study of Exercise and Kidney Disease: Hemodialysis and Transplantation:
78,A change point approach to analysing the match activity profiles of team-sport athletes:
79,A clinical comparison between dedifferentiated low-grade osteosarcoma and conventional osteosarcoma:
80,A clinically applicable tool for rapidly estimating muscle volume using ultrasound images:
81,A cluster-randomized controlled trial to improve student experiences in physical education: Results of a student-centered learning intervention with high school teachers:
82,"A combination of an anteromedial, anterolateral and midlateral portals is sufficient for 360° exposure of the radial head for arthroscopic fracture fixation:"
83,A combination of oral l-citrulline and l-arginine improved 10-min full-power cycling test performance in male collegiate soccer players: a randomized crossover trial:
84,A combined procedure with Bereiter-type trochleoplasty leads to a stable patellofemoral joint at 5-year follow-up:
85,A community capacity building approach to sport-based youth development:
86,A Comparison of 3 Different Unilateral Strength Training Strategies to Enhance Jumping Performance and Decrease Interlimb Asymmetries in Soccer Players:
87,A comparison of accelerometry analysis methods for physical activity in older adult women and associations with health outcomes over time:
88,A comparison of emergency preparedness between high school coaches and club sport coaches:
89,A Comparison of Long-Term Outcomes of Computer-Navigated and Conventional Total Knee Arthroplasty: A Meta-Analysis of Randomized Controlled Trials:
90,A comprehensive cardiovascular disease risk profile in patients with schizophrenia:
91,A computational model of induced pluripotent stem-cell derived cardiomyocytes incorporating experimental variability from multiple data sources:
92,A concise shoulder outcome measure: application of computerized adaptive testing to the American Shoulder and Elbow Surgeons Shoulder Assessment:
93,A Contemporary Look at the Evaluation and Treatment of Adult Borderline and Frank Hip Dysplasia:
94,"A Cost-Effectiveness Analysis of a Randomized Control Trial of a Tailored, Multifactorial Program to Prevent Falls Among the Community-Dwelling Elderly:"
95,"A Cost-Effectiveness Analysis of Isolated Meniscal Repair Versus Partial Meniscectomy for Red-Red Zone, Vertical Meniscal Tears in the Young Adult:"
96,A Cost-utility Analysis of Percutaneous Endoscopic Lumbar Discectomy for L5-S1 Lumbar Disc Herniation: Transforaminal versus Interlaminar:
97,A Critique of the Dragon Challenge:
98,A cross-level moderating effect of team trust on the relationship between transformational leadership and cohesion:
99,A Cross-Sectional Study to Investigate the Effects of Perceived Discrimination in the Health Care Setting on Pain and Depressive Symptoms in Wheelchair Users With Spinal Cord Injury:
100,"A daily diary study of interpersonal emotion regulation, the social environment, and team performance among university athletes:"
101,"A data-driven, meaningful, easy to interpret, standardised accelerometer outcome variable for global surveillance:"
102,A Day at the Office: Dynamic Employee Engagement Can Reduce Your Private Practice's Overhead Expenses:
103,A Day at the Office: How Private Practicing Orthopaedic Surgeons Grow Their Knowledge Base:
104,A Day at the Office: Private Practice and Private Equity:
105,A decade of hip injuries in national collegiate athletic Association football players: An epidemiologic study using national collegiate athletic Association surveillance data:
106,A dedicated revision total knee service: A surgeon’s perspective:
107,A Different Perspective of the 3-Minute All-Out Exercise Test:
108,A feasibility study to assess the individual and combined effects of financial incentives and monetary contingency contracts on physical activity:
109,A Flat Anterior Glenoid Corresponds to Subcritical Glenoid Bone Loss:
110,A flexion osteotomy for correction of a distal tibial recurvatum deformity:
111,A fluoroscopic analysis of the length changes of the capsulo-osseous layer of the distal iliotibial band:
112,A focused update on preventing ceramic fractures in hip arthroplasty: Is the ‘cup’ half full?:
113,A Framework to evaluate devices that assess physical behavior:
114,A General Population Utility Valuation Study for Metastatic Epidural Spinal Cord Compression Health States:
115,A Genome-Wide Association Study of Sprint Performance in Elite Youth Football Players:
116,A grounded theory of inspirational coach leadership:
117,A Guide to Understanding the Benefits of a Multidisciplinary Team Approach to Amyotrophic Lateral Sclerosis (ALS) Treatment:
118,A Hamstring-Based Anatomic Posterolateral Knee Reconstruction With Autografts Improves Both Radiographic Instability and Functional Outcomes:
119,A helmetless-tackling intervention in American football for decreasing head impact exposure: A randomized controlled trial:
120,A hierarchy of corticospinal plasticity in human hand and forearm muscles:
121,A high level of satisfaction after bicompartmental individualized knee arthroplasty with patient-specific implants and instruments:
122,A higher reoperation rate following arthroplasty for failed fixation versus primary arthroplasty for the treatment of proximal humeral fractures: A retrospective population-based study:
123,A history of previous severe injury and health-related quality of life among former collegiate athletes:
124,A hitchhiker's guide to assessing young people's motor competence: Deciding what method to use:
125,A holistic perspective on women's career pathways in athletics administration:
126,A home advantage? Examining 100 years of team success in National Hockey League playoff overtime games:
127,A jolt to the field: a self-generating and self-propagating ephaptically mediated slow spontaneous network activity pattern in the hippocampus:
128,A journey continues:
129,A landmark-based 3D analysis reveals a narrower tibial plateau and patella in trochlear dysplastic knees:
130,A load-measuring device can achieve fine-tuning of mediolateral load at knee arthroplasty but may lead to a more lax knee state:
131,A low-calorie diet with or without interval exercise training improves adiposopathy in obese women:
132,A Magnetic Resonance Imaging Analysis of Shrinkage of Transplanted Fresh-Frozen Lateral Meniscal Allografts During a Minimum Follow-up of 8 Years:
133,A Majority of Anterior Cruciate Ligament Injuries Can Be Prevented by Injury Prevention Programs: A Systematic Review of Randomized Controlled Trials and Cluster–Randomized Controlled Trials With Meta-analysis:
134,A match-derived relative pitch area facilitates the tactical representativeness of small-sided games for the official soccer match:
135,A maternal low-protein diet and neonatal overnutrition result in similar changes to glomerular morphology and renal cortical oxidative stress measures in male wistar rats:
136,A mathematical model for decision-making in the classification of para-footballers with different severity of coordination impairments:
137,A meta-analysis of meta-analyses of the effectiveness of FIFA injury prevention programs in soccer:
138,A Meta-Analysis of Plyometric Training in Female Youth: Its Efficacy and Shortcomings in the Literature:
139,A Meta-analysis of Surgical Versus Nonsurgical Treatment of Primary Patella Dislocation:
140,A meta-analytic review of the relationship between social constructs and athlete burnout:
141,A meta-study of qualitative research on the junior-to-senior transition in sport:
142,A method to standardize the blood flow restriction pressure by an elastic cuff:
143,A Method to Stop Analyzing Random Error and Start Analyzing Differential Responders to Exercise:
144,A model for the generation of public sphere-like activity in sport-themed Twitter hashtags:
145,A model-based analysis of autonomic nervous function in response to the Valsalva maneuver:
146,A moderately elevated soy protein diet mitigates inflammatory changes in gut and in bone turnover during chronic TNBS-induced inflammatory bowel disease:
147,A Modification of the Fibular Osteotomy for Total Ankle Replacement Through the Lateral Transfibular Approach:
148,A molecular rheostat: Kv2.1 currents maintain or suppress repetitive firing in motoneurons:
149,A molecular toolbox for interrogation of membrane contact sites:
150,A monitoring system to provide feedback on student physical activity during physical education lessons:
151,A more flattened bone tunnel has a positive effect on tendon–bone healing in the early period after ACL reconstruction:
152,A Morphometric study on subaxial cervical pedicles of thai people:
153,A motor physiology recurrent topic: simplify assumptions to gain extra insight:
154,A mouse model of gestational glucose intolerance through exposure to a low protein diet during fetal and neonatal development:
155,A multifactorial assessment of elite paratriathletes' response to 2 weeks of intensified training:
156,A multilevel analysis of implicit and explicit CSR in French and UK professional sport:
157,A multilevel hypernetworks approach to capture meso-level synchronisation processes in football:
158,A multi-year injury epidemiology analysis of an elite national junior tennis program:
159,A National analysis on predictors of discharge to rehabilitation after corrective surgery for adolescent idiopathic scoliosis:
160,A nervous S1P of the lung: activation of airway nerves by sphingosine-1-phosphate:
161,A new ‘tail’ of aquaporin-2:
162,A new approach to estimate aerobic fitness using the NHANES dataset:
163,A new conceptualization of mega sports event legacy delivery: Wicked problems and critical realist solution:
164,A new coupling of an acid-base transporter to PKD and cyst formation:
165,A New Mathematical Approach to Explore the Post-exercise Recovery Process and Its Applicability in a Cold Water Immersion Protocol:
166,A new risk to the axillary nerve during percutaneous proximal humeral plate fixation using the Synthes PHILOS aiming system:
167,A new scoring system for prediction of meniscal repair in traumatic meniscal tears:
168,A New Short Track Test to Estimate the V[Combining Dot Above]O2max and Maximal Aerobic Speed in Well-Trained Runners:
169,"A new, MRI-based classification system for tibial spine fractures changes clinical treatment recommendations when compared to Myers and Mckeever:"
170,A Novel Approach for Assessing and Training the Drilling Skills of Orthopaedic Surgeons:
171,A novel approach for establishing fitness standards for occupational task performance:
172,A Novel Coding Variant in SLC39A8 is Associated with Adolescent Idiopathic Scoliosis in Chinese Han Population:
173,A novel diagnostic method to predict subscapularis tendon tear with sagittal oblique view magnetic resonance imaging:
174,A novel form of glycolytic metabolism-dependent cardioprotection revealed by PKC? and ? inhibition:
175,A novel hamstring strain injury prevention system: Post-match strength testing for secondary prevention in football:
176,A novel method of assessment for monitoring neuromuscular fatigue in Australian rules football players:
177,A novel method to assess rate of force relaxation: reliability and comparisons with rate of force development across various muscles:
178,A Novel Risk Calculator Predicts 90-Day Readmission Following Total Joint Arthroplasty:
179,A novel role for the extracellular matrix glycoprotein-Tenascin-X in gastric function:
180,A novel role of probiotics in improving host defence of elite rugby union athlete: A double blind randomised controlled trial:
181,A Novel Technique for Total en bloc Spondylectomy of the Fifth Lumbar Tumor Through Posterior-Only Approach:
182,A Novel Treatment for Anterior Shoulder Instability: A Biomechanical Comparison between a Patient-Specific Implant and the Latarjet Procedure:
183,"A novel, automated text-messaging system is effective in patients undergoing total joint arthroplasty:"
184,A nutrient cocktail prevents lipid metabolism alterations induced by 20 days of daily steps reduction and fructose overfeeding: Result from a randomized study:
185,A perceptual framework for conservative treatment and rehabilitation of ankle sprains: An evidence-based paradigm shift:
186,A perpetual switching system in pulmonary capillaries:
187,A Physiologically Based Approach to Prescribing Exercise Following a Sport-Related Concussion:
188,A pilot primary school active break program (ACTI-BREAK): Effects on academic and physical activity outcomes for students in Years 3 and 4:
189,A population-based comparison of joint survival of hemiarthroplasty versus total shoulder arthroplasty in osteoarthritis and rheumatoid arthritis:
190,A porcine model for studying the cardiovascular consequences of high-thoracic spinal cord injury:
191,A precise method for determining acetabular component anteversion after total hip arthroplasty:
192,A preclinical model of non-invasive stimulation reduces spinal cord injury initiated spasticity:
193,A preliminary evaluation of the associations among functional performance tasks and quality of life in obese and healthy weight youth:
194,A pre-operative grade 3 J-sign adversely affects short-term clinical outcome and is more likely to yield MPFL residual graft laxity in recurrent patellar dislocation:
195,A Preventive Model for Hamstring Injuries in Professional Soccer: Learning Algorithms:
196,A primer on investigating the after effects of acute bouts of physical activity on cognition:
197,A Principle of Neuromechanical Matching for Motor Unit Recruitment in Human Movement:
198,A proof-of-concept trial of HELIOX with different fractions of helium in a human study modeling upper airway obstruction:
199,A proposal for a new classification of pes anserinus morphology:
200,A proposed conceptualization of talent in sport: The first step in a long and winding road:
201,A Prospective Analysis of Patients With Anterior Versus Posterior Shoulder Instability: A Matched Cohort Examination and Surgical Outcome Analysis of 200 Patients:
202,"A prospective cohort study of load and wellness (sleep, fatigue, soreness, stress, and mood) in elite junior Australian football players:"
203,A Prospective Longitudinal Study of Trajectories of Depressive Symptoms After Dysvascular Amputation:
204,A prospective randomized open-label study of single injection versus continuous adductor canal block for postoperative analgesia after total knee arthroplasty:
205,A Prospective Randomized Trial Comparing Suture Bridge and Medially Based Single-Row Rotator Cuff Repair in Medium-Sized Supraspinatus Tears:
206,A prospective randomized trial examining the use of a closed suction drain shows no influence on strength or function in primary total knee arthroplasty:
207,A prospective study assessing the political advocacy of American Shoulder and Elbow Surgeons members:
208,"A Prospective, Psychometric Validation of National Institutes of Health Patient-Reported Outcomes Measurement Information System Physical Function, Pain Interference, and Upper Extremity Computer Adaptive Testing in Cervical Spine Patients: Successes and Key Limitations:"
209,"A protective hinge wire, intersecting the osteotomy plane, can reduce the occurrence of perioperative hinge fractures in medial opening wedge osteotomy:"
210,A qualitative investigation of coaches’ doping confrontation efficacy beliefs:
211,A question of 'fairness': Why ethics should factor in the Court of Arbitration for Sport's decision on the IAAF Hyperandrogenism Regulations:
212,A randomised controlled trial of movement quality-focused exercise versus traditional resistance exercise for improving movement quality and physical performance in trained adults:
213,"A Randomized Clinical Trial Comparing Patellar Tendon, Hamstring Tendon, and Double-Bundle ACL Reconstructions: Patient-Reported and Clinical Outcomes at 5-Year Follow-up:"
214,A Randomized Controlled Pilot Study of a Manualized Intervention for Caregivers of Patients With Traumatic Brain Injury in Inpatient Rehabilitation:
