Number,Title
5919,"Relationship between various training-load measures in elite cyclists during training, road races, and time trials:"
5920,Relationship between vertical stiffness and soft-tissue injuries in professional Australian football:
5921,"Relationship between VO2 peak, cycle economy, and mitochondrial respiration in untrained/trained:"
5922,Relationship of Activity Patterns to Acute Mountain Sickness in South Pole Workers:
5923,Relationship of Foot Strike Pattern and Landing Impacts during a Marathon:
5924,Relationship of Strength and Conditioning Metrics to Success on the Army Ranger Physical Assessment Test:
5925,Relationship of Training Load with High-intensity Running in Professional Soccer Players:
5926,"Relationships Among Circuit Training, Small-Sided and Mini Goal Games, and Competition in Professional Soccer Players: A Comparison of On-Field Integrated Training Routines:"
5927,"Relationships between cardiorespiratory fitness, inhibition, and math fluency: A cluster analysis:"
5928,Relationships between Challenge Tour golfers’ clubhead velocity and force producing capabilities during a countermovement jump and isometric mid-thigh pull:
5929,Relationships Between Dry-land Resistance Training and Swim Start Performance and Effects of Such Training on the Swim Start: A Systematic Review:
5930,Relationships between met-expectation and attitudinal outcomes of coaches in intercollegiate athletics:
5931,Relationships between model-predicted and actual match-play exercise-intensity performance in professional Australian footballers during a preseason training macrocycle:
5932,Relationships between physical testing and match activity profiles across the Australian Football League participation pathway:
5933,"Relationships between Results of an Internal and External Match Load Determining Method in Male, Singles Badminton Players:"
5934,Relationships between talent development environments and mental toughness: The role of basic psychological need satisfaction:
5935,Relationships Between Wheelchair Services Received and Wheelchair User Outcomes in Less-Resourced Settings: A Cross-Sectional Survey in Kenya and the Philippines:
5936,"Relative Age Effect in Collegiate Soccer: Influence of Nationality, Playing Position, and Class:"
5937,Relative age effect: Characteristics of youth soccer players by birth quarter and subsequent playing status:
5938,"Relative Efficacy of Different Exercises for Pain, Function, Performance and Quality of Life in Knee and Hip Osteoarthritis: Systematic Review and Network Meta-Analysis:"
5939,Release of the medial collateral ligament is mandatory in medial open-wedge high tibial osteotomy:
5940,Reliability and concurrent validity of seven commercially available devices for the assessment of movement velocity at different intensities during the bench press:
5941,Reliability and validity of a novel futsal special performance test designed to measure skills and anaerobic performance:
5942,Reliability and validity of a novel trunk-strength assessment for high-performance sprint flat-water kayakers:
5943,Reliability and Validity of a Pool-Based Maximal Oxygen Uptake Test to Examine High-Intensity Short-Duration Freestyle Swimming Performance:
5944,Reliability and validity of depth camera 3D scanning to determine thigh volume:
5945,Reliability and validity of different methods of estimating the one-repetition maximum during the free-weight prone bench pull exercise:
5946,Reliability and Validity of the Adapted Dutch Version of the Early-Onset Scoliosis-24-Item Questionnaire (EOSQ-24):
5947,Reliability and Validity of the Turkish Version of the Fremantle Back Awareness Questionnaire:
5948,Reliability of a measurement technique for achilles tendon length:
5949,Reliability of FORCE COMBAT™: A Canadian army fitness objective:
5950,Reliability of force-velocity parameters obtained from linear and curvilinear regressions for the bench press and squat exercises:
5951,Reliability of methods to measure energy expenditure during and after resistance exercise:
5952,Reliability of NIRS portable device for measuring intercostal muscles oxygenation during exercise:
5953,Reliability of squat kinetics in well-trained rugby players: Implications for monitoring training:
5954,Reliability of the Load-Velocity Relationship and Validity of the PUSH to Measure Velocity in the Deadlift:
5955,Reliability of the maximal resisted sprint load test and relationships with performance measures and anthropometric profile in female field sport athletes:
5956,Reliability of the OptoJump Next System for Measuring Temporal Values in Elite Racewalking:
5957,Reliability of the Tönnis Classification and Its Correlation With Magnetic Resonance Imaging and Intraoperative Chondral Damage:
5958,Reliability of Trail Walking and Running Tasks Using the Stryd Power Meter:
5959,"Reliability of zephyr bioharness and fitbit charge measures of heart rate and activity at rest, during the modified Canadian aerobic fitness test, and recovery:"
5960,"Reliability, usefulness and construct validity of the Combined Basketball Skill Test (CBST):"
5961,"Reliability, Usefulness, and Factorial Validity of Change-of-direction Speed Tests in Adolescent Basketball Players:"
5962,"Reliability, Validity and Utility of Inertial Sensor Systems for Postural Control Assessment in Sport Science and Medicine Applications: A Systematic Review:"
5963,Reliable outcomes and survivorship of primary total knee arthroplasty for osteonecrosis of the knee:
5964,Reliable sideline ocular-motor assessment following exercise in healthy student athletes:
5965,Remote ischemic preconditioning increases accumulated oxygen deficit in middle-distance runners:
5966,Removing relative age effects from youth swimming: The development and testing of corrective adjustment procedures:
5967,Remplissage With Bankart Repair in Anterior Shoulder Instability: A Systematic Review of the Clinical and Cadaveric Literature:
5968,Renal and segmental artery hemodynamics during whole body passive heating and cooling recovery:
5969,Reoperation Rate After Microsurgical Uni- or Bilateral Laminotomy for Lumbar Spinal Stenosis With and Without Low-grade Spondylolisthesis: What do Preoperative Radiographic Parameters Tell Us?:
5970,Repair and augmentation of the lateral collateral ligament complex using internal bracing in dislocations and fracture dislocations of the elbow restores stability and allows early rehabilitation:
5971,"Repair Augmentation of Unstable, Complete Vertical Meniscal Tears With Bone Marrow Venting Procedure: A Prospective, Randomized, Double-Blind, Parallel-Group, Placebo-Controlled Study:"
5972,Repair of an Osteochondral Defect With Minced Cartilage Embedded in Atelocollagen Gel: A Rabbit Model:
5973,Repair of Lafosse I subscapularis lesions brings no benefit in anterosuperior rotator cuff reconstruction:
5974,Repair of Rotator Cuff Tears in the Elderly: Does It Make Sense? A Systematic Review:
5975,Repair of Rotator Cuff Tendon Defects in Aged Rats Using a Growth Factor Injectable Gel Scaffold:
5976,Repair of the entire superior acromioclavicular ligament complex best restores posterior translation and rotational stability:
5977,Repair with bicortical suspension device restores proximal tibiofibular joint motion:
5978,Repair within the first 48 h in the treatment of acute Achilles tendon ruptures achieves the best biomechanical and histological outcomes:
5979,Repeatability and specificity of eccentric force output and the implications for eccentric training load prescription:
5980,Repeatability of tibial acceleration measurements made on children during walking and running:
5981,Repeated anaerobic tests predict performance among a group of advanced crossfit-trained athletes:
5982,Repeated anodal trans-spinal direct current stimulation results in long-term reduction of spasticity in mice with spinal cord injury:
5983,Repeated Linear and Quadrangular Sprint as a Function of Anaerobic Power:
5984,Repeated muscle glycogen supercompensation with four days’ recovery between exhaustive exercise:
5985,Repeated-Sprint Ability in Division I Collegiate Male Soccer Players: Positional Differences and Relationships With Performance Tests:
5986,Repeated-sprint training in hypoxia in international rugby union players:
5987,Repetitive Head Impacts in Football Do Not Impair Dynamic Postural Control:
5988,Repetitive transcranial magnetic stimulation recovers cortical map plasticity induced by sensory deprivation due to deafferentiation:
5989,Replication Study for the Association of GWAS-associated Loci with Adolescent Idiopathic Scoliosis Susceptibility and Curve Progression in a Chinese Population:
5990,Report of the 2018 Arthroscopy Association of North America Traveling Fellowship—Friendship and Mentorship:
5991,Reporting of Mesenchymal Stem Cell Preparation Protocols and Composition: A Systematic Review of the Clinical Orthopaedic Literature:
5992,Reproducibility – again:
5993,Reproducibility and data presentation:
5994,Reproducibility of acute steroid hormone responses in men to short-duration running:
5995,Reproducibility of Heart Rate Variability Threshold in Untrained Individuals:
5996,Reproducibility of Inert Gas Rebreathing Method to Estimate Cardiac Output at Rest and during Cardiopulmonary Exercise Stress Testing:
5997,Reproducibility of the Kids-BESTest and the Kids-Mini-BESTest for Children With Cerebral Palsy:
5998,Re-revision anterior cruciate ligament reconstruction showed more laxity than revision anterior cruciate ligament reconstruction at a minimum 2-year follow-up:
5999,Re-revision Anterior Cruciate Ligament Reconstruction: An Evaluation From the Norwegian Knee Ligament Registry:
6000,Rescheduling Part 2 of the 11+ reduces injury burden and increases compliance in semi-professional football:
6001,Research and regulatory gaps for the substantiation of protein content claims on foods:
6002,Research in Musculoskeletal Pain Management: Time to Focus:
6003,"Research in nutritional supplements and nutraceuticals for health, physical activity, and performance: moving forward:"
6004,Research is like a bad game of 'telephone': Mitigating the information breakdown from clinicians and researchers to the general public:
6005,"Research, urban myths and the never ending story:"
6006,Research-Track Residency Programs in Orthopaedic Surgery: A Survey of Program Directors and Recent Graduates:
6007,Residency diary: Intern year (January to March)-Relearning everything:
6008,Residency Diary: Intern Year Part 2 (March-May) - Teams in Residency:
6009,Residency Diary: The Other Side of the Knife:
6010,Resident Surgical Skills Web-Based Evaluation: A Comparison of 2 Assessment Tools:
6011,"Residual Disability, Mortality, and Nursing Home Placement After Hip Fracture Over 2 Decades:"
6012,Residual medial tightness in extension is corrected spontaneously after total knee arthroplasty in varus knees:
6013,Resilience Among Caregivers of Injured Service Members: Finding the Strengths in Caregiving:
6014,Resistance Exercise Counteracts Tumor Growth in Two Carcinoma Rodent Models:
6015,Resistance exercise-induced changes in muscle phenotype are load dependent:
6016,Resistance Exercise-Induced Hypertrophy: A Potential Role for Rapamycin-Insensitive mTOR:
6017,"Resistance Priming to Enhance Neuromuscular Performance in Sport: Evidence, Potential Mechanisms and Directions for Future Research:"
6018,Resistance to the sympathoexcitatory effects of insulin and leptin in late pregnant rats:
6019,Resistance Training and Skeletal Muscle Protein Metabolism in Eumenorrheic Females: Implications for Researchers and Practitioners:
6020,Resistance training as a treatment for older persons with peripheral artery disease: A systematic review and meta-analysis:
6021,Resistance training enhances delayed memory in healthy middle-aged and older adults: A randomised controlled trial:
6022,Resistance Training for Older Adults: Position Statement From the National Strength and Conditioning Association:
6023,Resistance training frequencies of 3 and 6 times per week produce similar muscular adaptations in resistance-trained men:
6024,Resistance training frequency and skeletal muscle hypertrophy: A review of available evidence:
6025,Resistance training induced changes in strength and specific force at the fiber and whole muscle level: a meta-analysis:
6026,Resistance Training Induces Antiatherogenic Effects on Metabolomic Pathways:
6027,Resistance training reduces depressive symptoms in elderly people with Parkinson disease: A controlled randomized study:
6028,Resistance Training Volume Enhances Muscle Hypertrophy but Not Strength in Trained Men:
6029,Resistance training with interval blood flow restriction effectively enhances intramuscular metabolic stress with less ischemic duration and discomfort:
6030,Resistance-exercise training ameliorates LPS-induced cognitive impairment concurrent with molecular signaling changes in the rat dentate gyrus:
6031,Respiratory capacity is maintained despite Duchenne muscular dystrophy-related diaphragm weakness:
6032,Respiratory Complications after Posterior Spinal Fusion for Neuromuscular Scoliosis: Children with Rett Syndrome at Greater Risk Than Those with Cerebral Palsy:
6033,Respiratory modulation of peripheral vasoconstriction: A modeling perspective:
6034,Respiratory muscle training in athletes with cervical spinal cord injury: effects on cardiopulmonary function and exercise capacity:
6035,Respiratory muscle training in spinal cord injury: a breath of fresh air for the heart:
6036,Respiratory system reactance reflects communicating lung volume in chronic obstructive pulmonary disease:
6037,Respiratory-related displacement of the trachea in obstructive sleep apnea:
6038,Response of the Injured Tendon to Growth Factors in the Presence or Absence of the Paratenon:
6039,Response shift after a 4-week multimodal intervention for chronic ankle instability:
6040,Responses to multi-level institutional complexity in a national sport federation:
6041,Responsiveness and Minimal Important Change of the IKDC of Middle-Aged and Older Patients With a Meniscal Tear:
6042,"Responsiveness and Predictive Validity of the Participation Measure–3 Domains, 4 Dimensions in Survivors of Stroke:"
6043,Responsiveness and seasonal variation of a 12 × 25-m swimming test:
6044,Responsiveness of EQ-5D Youth version 5-level (EQ-5D-5L-Y) and 3-level (EQ-5D-3L-Y) in Patients with Idiopathic Scoliosis:
6045,Responsiveness of the anterior cruciate ligament–Return to Sports after Injury (ACL-RSI) and Injury–Psychological Readiness to Return to Sport (I-PRRS) scales:
6046,Responsiveness of the PROMIS and its Concurrent Validity with Other Region- And Condition-specific PROMs in Patients Undergoing Carpal Tunnel Release:
6047,Resting metabolic rate in muscular physique athletes: Validity of existing methods and development of new prediction equations:
6048,Restoring the autonomic balance to reduce liver steatosis:
6049,Results From a Randomized Controlled Trial to Address Balance Deficits After Traumatic Brain Injury:
6050,Results of growth-friendly management of early-onset scoliosis in children with and without skeletal dysplasias: A matched comparison:
6051,Results of total shoulder arthroplasty in patients aged 55 years or younger versus those older than 55 years: an analysis of 1135 patients with over 2 years of follow-up:
6052,Retaining the medial collateral ligament in high tibial medial open-wedge osteotomy mostly results in post-operative intra-articular gap reduction:
6053,Rethinking segmentation within the psychological continuum model using Bayesian analysis:
6054,"Retired Elite Athletes' Physical Activity, Physiological, and Psychosocial Outcomes During Single- and Double-Player Exergaming:"
6055,Retrieval analysis of contemporary antioxidant polyethylene: multiple material and design changes may decrease implant performance:
6056,Retrograde and oscillatory shear rate in young anabolic androgenic steroid users:
6057,Retrospective review of open and arthroscopic repair of anterosuperior rotator cuff tears with subscapularis involvement: a single surgeon's experience:
6058,Retrospective self-reported dietary supplement use by australian military personnel during deployment to Iraq and afghanistan: Results from the middle east area of operations health study:
6059,"Retrospective, nonrandomized analysis of subcutaneous anterior transposition versus in situ decompression of the ulnar nerve of military service members:"
6060,Retro-tubercular gap widening can be caused by inappropriate anterior osteotomy and large opening gap in the medial biplanar open-wedge HTO:
6061,Return to Basketball After Hip Arthroscopy: Minimum 2-Year Follow-up:
6062,Return to Dance and Predictors of Outcome After Hip Arthroscopy for Femoroacetabular Impingement Syndrome:
6063,Return to play after arthroscopic treatment for shoulder instability in elite and professional baseball players:
6064,Return to play after surgery for isolated unstable syndesmotic ankle injuries (West Point grade IIB and III) in 110 male professional football players: A retrospective cohort study:
6065,Return to Play After the Latarjet Procedure for Anterior Shoulder Instability: A Systematic Review:
6066,Return to Play and In-Game Performance Statistics Among Pitchers After Ulnar Collateral Ligament Reconstruction of the Elbow: A Systematic Review:
6067,Return to Play and Long-term Participation in Pivoting Sports After Anterior Cruciate Ligament Reconstruction:
6068,Return to Sport After Surgical Treatment for Anterior Shoulder Instability: A Systematic Review:
6069,Return to sport after surgical treatment for high-grade (Rockwood III–VI) acromioclavicular dislocation:
6070,Return to Sport and Reoperation Rates in Patients Under the Age of 20 After Primary Anterior Cruciate Ligament Reconstruction: Risk Profile Comparing 3 Patient Groups Predicated Upon Skeletal Age:
6071,Return to Sport and Sports-Specific Outcomes After Osteochondral Allograft Transplantation in the Knee: A Systematic Review of Studies With at Least 2 Years' Mean Follow-Up:
6072,Return to Sport and Work After High Tibial Osteotomy With Concomitant Medial Meniscal Allograft Transplant:
6073,Return to Sport as an Outcome Measure for Shoulder Instability: Surprising Findings in Nonoperative Management in a High School Athlete Population:
6074,Return to Sport Following Revision Anterior Cruciate Ligament Reconstruction in Athletes: A Systematic Review:
6075,Return to Sports After in Situ Arthroscopic Repair of Partial Rotator Cuff Tears:
6076,Return to Sports and Clinical Outcomes After Arthroscopic Anatomic Posterior Cruciate Ligament Reconstruction With Remnant Preservation:
6077,Return to work after shoulder arthroplasty: a systematic review and meta-analysis:
6078,Return to Work and Sport After Proximal Tibial Osteotomy and the Effects of Opening Versus Closing Wedge Techniques on Adverse Outcomes: A Systematic Review and Meta-analysis:
6079,Return to Work Following High Tibial Osteotomy With Concomitant Osteochondral Allograft Transplantation:
6080,Returning to Activity After a Concussion:
6081,Returning to Work After Mild Stroke:
6082,Return-to-Play Practices Following Hamstring Injury: A Worldwide Survey of 131 Premier League Football Teams:
6083,Return-to-Work Barriers Among Manual Workers After Hand Injuries: 1-Year Follow-up Cohort Study:
6084,Reverse shoulder arthroplasty for acute fractures in the elderly: is it worth reattaching the tuberosities?:
6085,Reverse shoulder arthroplasty for proximal humerus fracture: a more complex episode of care than for cuff tear arthropathy:
6086,Reverse shoulder arthroplasty has a higher risk of revision due to infection than anatomical shoulder arthroplasty:
6087,Reverse shoulder arthroplasty in the treatment of glenohumeral instability:
6088,Reverse shoulder arthroplasty versus nonoperative treatment for 3- or 4-part proximal humeral fractures in elderly patients: a prospective randomized controlled trial:
6089,Reverse total shoulder arthroplasty and resting radiographic scapular rotation:
6090,Reverse total shoulder arthroplasty provides stability and better function than hemiarthroplasty following resection of proximal humerus tumors:
6091,Review of criterion-referenced standards for cardiorespiratory fitness: what percentage of 1?142?026 international children and youth are apparently healthy?:
6092,Review of WADA Prohibited Substances: Limited Evidence for Performance-Enhancing Effects:
6093,Revised Approach to the Role of Fatigue in Anterior Cruciate Ligament Injury Prevention: A Systematic Review with Meta-Analyses:
6094,Revised Cardiac Risk Index as a Predictor for Myocardial Infarction and Cardiac Arrest Following Posterior Lumbar Decompression:
6095,Revision ACL reconstruction using quadriceps or hamstring autografts leads to similar results after 4 years: good objective stability but low rate of return to pre-injury sport level:
6096,Revision anterior cruciate ligament reconstruction restores knee laxity but shows inferior functional knee outcome compared with primary reconstruction:
6097,Revision Arthroscopic Posterior Shoulder Capsulolabral Repair in Contact Athletes: Risk Factors and Outcomes:
6098,Revision knee complexity classification—RKCC: a common-sense guide for surgeons to support regional clinical networking in revision knee surgery:
6099,Revision of an infected total hip arthroplasty:
6100,Revision of failed hemiarthroplasty and anatomic total shoulder arthroplasty to reverse total shoulder arthroplasty:
6101,"Revision Risk for Total Knee Arthroplasty Converted from Medial Unicompartmental Knee Arthroplasty: Comparison with Primary and Revision Arthroplasties, Based on Mid-Term Results from the Danish Knee Arthroplasty Registry:"
6102,"Revision Total Hip Arthroplasty for the Treatment of Fracture: More Expensive, More Complications, Same Diagnosis-Related Groups: A Local and National Cohort Study:"
6103,Revisions of Modular Metal-on-metal THA Have a High Risk of Early Complications:
6104,Revisiting human cerebral blood flow responses to augmented blood pressure oscillations:
6105,"Revisiting the International Normalized Ratio (INR) Threshold for Complications in Primary Total Knee Arthroplasty: An Analysis of 21,239 Cases:"
6106,Rhetorical legitimation strategies and sport and entertainment facilities in smaller Canadian cities:
6107,Ribosome biogenesis in skeletal muscle: Coordination of transcription and translation:
6108,Ribosome specialization and its potential role in the control of protein translation and skeletal muscle size:
6109,Right ventricular function in elite male athletes meeting the structural echocardiographic task force criteria for arrhythmogenic right ventricular cardiomyopathy:
6110,Rigid Internal Fixation for Traumatic Cranio-Cervical Dissociation in Infants and Young Children:
6111,Risk and Prognostic Factors of Low Back Pain: Repeated Population-based Cohort Study in Sweden:
6112,Risk and protective factors for mental health in elite athletes: a scoping review:
6113,Risk Estimates for Diabetes and Hypertension with Different Physical Activity Methods:
6114,Risk Factors Associated With a Noncontact Anterior Cruciate Ligament Injury to the Contralateral Knee After Unilateral Anterior Cruciate Ligament Injury in High School and College Female Athletes: A Prospective Study:
6115,Risk factors for 30-day readmission following hip arthroscopy:
6116,Risk factors for admission after shoulder arthroscopy:
6117,Risk factors for anterior shoulder instability: a matched case-control study:
6118,Risk Factors for Cerebral Desaturation Events During Shoulder Surgery in the Beach Chair Position:
6119,Risk Factors for Delayed Presentation Among Patients with Musculoskeletal Injuries in Malawi:
6120,Risk Factors for Elbow and Shoulder Injuries in Adolescent Baseball Players: A Systematic Review:
6121,Risk Factors for Failure after 1-Stage Exchange Total Knee Arthroplasty in the Management of Periprosthetic Joint Infection:
6122,Risk factors for initial and subsequent core or lower extremity sprain or strain among collegiate football players:
6123,Risk factors for lateral ankle sprains and chronic ankle instability:
6124,Risk Factors for Lateral Meniscus Posterior Root Tears in the Anterior Cruciate Ligament–Injured Knee: An Epidemiological Analysis of 3956 Patients From the SANTI Study Group:
6125,Risk Factors for Loss to Follow-up in 3202 Patients at 2 Years After Anterior Cruciate Ligament Reconstruction: Implications for Identifying Health Disparities in the MOON Prospective Cohort Study:
6126,Risk factors for musculoskeletal injuries in elite junior tennis players: a systematic review:
6127,Risk Factors for Opioid Use After Anterior Cruciate Ligament Reconstruction:
6128,Risk factors for patellofemoral pain: A systematic review and meta-analysis:
6129,Risk Factors for Positive Cultures in Presumed Aseptic Revision Spine Surgery:
6130,Risk Factors for Postoperative Opioid Use in Arthroscopic Meniscal Surgery:
6131,Risk Factors for Rapidly Progressive Neurological Deterioration in Cervical Spondylotic Myelopathy:
6132,Risk Factors for Suboptimal Medication Adherence in Persons With Multiple Sclerosis: Development of an Electronic Health Record-Based Explanatory Model for Disease-Modifying Therapy Use:
6133,Risk factors for the development of avascular necrosis after femoral neck fractures in children:
6134,Risk factors for ulnar collateral ligament injury in professional and amateur baseball players: a systematic review with meta-analysis:
6135,Risk factors of stress fractures due to the female athlete triad: Differences in teens and twenties:
