Number,Title
1871,Cuff inflation time significantly affects blood flow recorded with venous occlusion plethysmography:
1872,Cultural sport psychology as a pathway to advances in identity and settlement research to practice:
1873,"Culture, Health, Function, and Participation Among American Indian and Alaska Native Children and Youth With Disabilities: An Exploratory Qualitative Analysis:"
1874,Cumulative Incidence of Osteochondritis Dissecans of the Capitellum in Preadolescent Baseball Players:
1875,Curcumin improves exercise performance of mice with coronary artery ligation-induced HFrEF: Nrf2 and antioxidant mechanisms in skeletal muscle:
1876,Current Anti-Doping Crisis: The Limits of Medical Evidence Employing Inductive Statistical Inference:
1877,Current Concepts in the Operative Management of Acromioclavicular Dislocations: A Systematic Review and Meta-analysis of Operative Techniques:
1878,Current Insights into the Potential Misuse of Platelet-based Applications for Doping in Sports:
1879,Current State in Scientific Publishing: AOA Critical Issues Symposium:
1880,"Current understanding of the effects of inspiratory resistance on the interactions between systemic blood pressure, cerebral perfusion, intracranial pressure, and cerebrospinal fluid dynamics:"
1881,Currently used imaging options cannot accurately predict subtalar joint instability:
1882,Curtin University: A contemporary Master of Clinical Physiotherapy (sports) 'down under' (continuing professional development series):
1883,Curved-guide system is useful in achieving optimized trajectory for the most inferior suture anchor during arthroscopic Bankart repair:
1884,"Customised bi-compartmental knee arthroplasty shows encouraging 3-year results: findings of a prospective, multicenter study:"
1885,Cut points of the Actigraph GT9X for moderate and vigorous intensity physical activity at four different wear locations:
1886,Cutibacterium Acnes (Formerly Propionibacterium Acnes) Contamination of the Surgical Field During Shoulder Arthroscopy:
1887,Cutibacterium acnes in primary reverse shoulder arthroplasty: from skin to deep layers:
1888,Cutibacterium acnes persists despite topical clindamycin and benzoyl peroxide:
1889,Cutoff Score of the Lower-Extremity Motor Subscale of Fugl-Meyer Assessment in Chronic Stroke Survivors: A Cross-Sectional Study:
1890,Cutting to the pathophysiology chase: Translating cutting-edge neuroscience to rehabilitation practice in sports-related concussion management:
1891,Cyclic and Load-to-Failure Properties of All-Suture Anchors in Human Cadaveric Shoulder Glenoid Bone:
1892,"Cycling and cardiovascular disease risk factors including body composition, blood lipids and cardiorespiratory fitness analysed as continuous variables: Part 2 - Systematic review with meta-analysis:"
1893,Cycling at altitude: Lower absolute power output as the main cause of lower gross efficiency:
1894,Cycling is associated with a lower incidence of cardiovascular diseases and death: Part 1 - Systematic review of cohort studies with meta-analysis:
1895,Cycling performed on an innovative ergometer at different intensities–durations in men: Neuromuscular fatigue and recovery kinetics:
1896,Cycling Power Profile Characteristics of National-Level Junior Triathletes:
1897,Cycling time trial performance is improved by carbohydrate ingestion during exercise regardless of a fed or fasted state:
1898,Cycling with blood flow restriction improves performance and muscle K+ regulation and alters the effect of anti-oxidant infusion in humans:
1899,Cytokine and Sclerostin Response to High-Intensity Interval Running versus Cycling:
1900,"Cytokine responses to repeated, prolonged walking in lean versus overweight/obese individuals:"
1901,"Cytokine, glycemic, and insulinemic responses to an acute bout of games-based activity in adolescents:"
1902,Daily heat treatment maintains mitochondrial function and attenuates atrophy in human skeletal muscle subjected to immobilization:
1903,Daily Step Counts for Measuring Physical Activity Exposure and Its Relation to Health:
1904,"Damage and the repeated bout effect of arm, leg, and trunk muscles induced by eccentric resistance exercises:"
1905,"Damage protective effects conferred by low-intensity eccentric contractions on arm, leg and trunk muscles:"
1906,"Daniel Jordan Solomon, M.D., Associate Editor:"
1907,Danish Hip Arthroscopy Registry: predictors of outcome in patients with femoroacetabular impingement (FAI):
1908,Data-informed Intervention Improves Football Technique and Reduces Head Impacts:
1909,Day-level sedentary pattern estimates derived from hip-worn accelerometer cut-points in 8–12-year-olds: Do they reflect postural transitions?:
1910,Debridement and hinged motion distraction is superior to debridement alone in patients with ankle osteoarthritis: a prospective randomized controlled trial:
1911,Deceleration characteristics of elite Australian male field hockey players during an Olympic tournament:
1912,"Deceleration, Acceleration, and Impacts Are Strong Contributors to Muscle Damage in Professional Australian Football:"
1913,"Decision reinvestment, pattern recall and decision making in rugby union:"
1914,Decision Support Strategies for Hip and Knee Osteoarthritis: Less Is More: A Randomized Comparative Effectiveness Trial (DECIDE-OA Study):
1915,Declarative memory affects procedural memory: The role of semantic association and sequence matching:
1916,Decline in cardiorespiratory fitness in the Swedish working force between 1995 and 2017:
1917,Decompression with or without Fusion for Lumbar Stenosis: A Cost Minimization Analysis:
1918,Decreased dynamic balance and dorsiflexion range of motion in young and middle-aged adults with chronic ankle instability:
1919,Decreased external rotation strength is a risk factor for overuse shoulder injury in youth elite handball athletes:
1920,Decreased Graft Thickness Is Associated With Subchondral Cyst Formation After Osteochondral Allograft Transplantation in the Knee:
1921,Decreased Posterior Tibial Slope Does Not Affect Postoperative Posterior Knee Laxity After Double-Bundle Posterior Cruciate Ligament Reconstruction:
1922,Decreased supraspinal control and neuromuscular function controlling the ankle joint in athletes with chronic ankle instability:
1923,"Deep Infections After Pediatric Spinal Arthrodesis: Differences Exist with Idiopathic, Neuromuscular, or Genetic and Syndromic Cause of Deformity:"
1924,Deep ocean minerals inhibit IL-6 and IGFIIR hypertrophic signaling pathways to attenuate diabetes-induced hypertrophy in rat hearts:
1925,Deep peroneal nerve has a potential risk of injury during open-wedge high tibial osteotomy:
1926,Deep venous thrombosis and pulmonary embolism after anterior cruciate ligament reconstruction:
1927,Deepening trochleoplasty and medial patellofemoral ligament reconstruction normalize patellotrochlear congruence in severe trochlear dysplasia:
1928,Deficits in quadriceps force control after anterior cruciate ligament injury: Potential central mechanisms:
1929,Defining a Safe Zone for All-Inside Lateral Meniscal Repairs in Pediatric Patients: A Magnetic Resonance Imaging Study:
1930,Defining Meaningful Functional Improvement on the Visual Analog Scale for Satisfaction at 2 Years After Hip Arthroscopy for Femoroacetabular Impingement Syndrome:
1931,Defining Minimal Clinically Important Difference and Patient Acceptable Symptom State After Isolated Endoscopic Gluteus Medius Repair:
1932,Defining reference values for the normal tibiofibular syndesmosis in adults using weight-bearing CT:
1933,Defining the caudal hypothalamic arcuate nucleus with a focus on anorexic excitatory neurons:
1934,"Defining the Early, Mid, and Late Subsections of Sprint Acceleration in Division i Men's Soccer Players:"
1935,Defining the three most responsive and specific CT measurements of ankle syndesmotic malreduction:
1936,Definition of Successful Infection Management and Guidelines for Reporting of Outcomes after Surgical Treatment of Periprosthetic Joint Infection: From the Workgroup of the Musculoskeletal Infection Society (MSIS):
1937,Degenerative changes in cartilage likely occur in the medial compartment after anterior cruciate ligament reconstruction:
1938,Degenerative Disc Disease: What is in a Name?:
1939,Degenerative isolated cartilage defects of the patellofemoral joint are associated with more severe symptoms compared to trauma-related defects: results of the German Cartilage Registry (KnorpelRegister DGOU):
1940,Degenerative medial meniscus posterior root tear and non-root tear do not show differences in joint survival and clinical outcome after partial meniscectomy:
1941,Degree of Preoperative Subchondral Bone Marrow Lesion Is Associated With Postoperative Outcome After Medial Opening Wedge High Tibial Osteotomy:
1942,Delamination Does Not Affect Outcomes After Arthroscopic Rotator Cuff Repair as Compared With Nondelaminated Rotator Cuff Tears: A Study of 1043 Consecutive Cases:
1943,Delayed ACL Reconstruction in Patients ?40 Years of Age Is Associated With Increased Risk of Medial Meniscal Injury at 1 Year:
1944,Delayed cord clamping is associated with improved dynamic cerebral autoregulation and decreased incidence of intraventricular hemorrhage in preterm infants:
1945,Delayed Penetration of the Thoracic Aorta by Pedicle Screws: A Case Report of Screws Left As-Is:
1946,Delayed reconstruction and high BMI z score increase the risk of meniscal tear in paediatric and adolescent anterior cruciate ligament injury:
1947,Delayed-Onset Muscle Soreness and Topical Analgesic Alter Corticospinal Excitability of the Biceps Brachii:
1948,Delineating the age-related attenuation of vascular function: Evidence supporting the efficacy of the single passive leg movement as a screening tool:
1949,Demographic and Radiographic Factors Associated With Intra-articular Hip Cartilage Injury: A Cross-sectional Study of 1511 Hip Arthroscopy Procedures:
1950,Demographic and surgical factors affect quadriceps strength after ACL reconstruction:
1951,Demographics and Distal Tibial Dimensions of Suitable Distal Tibial Allografts for Glenoid Reconstruction:
1952,Demographic-specific Validity of the Cancer Prevention Study-3 Sedentary Time Survey:
1953,Denervation edema of hamstring muscles following acute strain injury:
1954,Depression and anxiety symptoms in 17 teams of female football players including 10 German first league teams:
1955,Depression and Non-modifiable Patient Factors Associated with Patient Satisfaction in an Academic Orthopaedic Outpatient Clinic: Is it More Than a Provider Issue?:
1956,Depression and physical activity research in older age: An important gap to fill:
1957,Depression and Subthreshold Depression in Stroke-Related Aphasia:
1958,Depression as a Predictor of Long-term Employment Outcomes Among Individuals With Moderate-to-Severe Traumatic Brain Injury:
1959,Deriving the arterial PO2 and oxygen deficit from expired gas and pulse oximetry:
1960,Dermal Calcium Loss Is Not the Primary Determinant of Parathyroid Hormone Secretion during Exercise:
1961,"Derotational femoral osteotomy changes patella tilt, patella engagement and tibial tuberosity trochlear groove distance:"
1962,Derotational osteotomy at the distal femur is effective to treat patients with patellar instability:
1963,Descriptive conversion of performance indicators in rugby union:
1964,Design and Implementation of an Enhanced Recovery after Surgery (ERAS) Program for Minimally Invasive Lumbar Decompression Spine Surgery: Initial Experience:
1965,Design archetype utility for understanding and analyzing the governance of contemporary national sport organizations:
1966,Design improvement in patient-specific instrumentation for total knee arthroplasty improved the accuracy of the tibial prosthetic alignment in the coronal and axial planes:
1967,Designing and implementing a curriculum for Sports and Exercise Medicine elective course for undergraduate medical students of Tehran University of Medical Sciences:
1968,"Despite patient-reported outcomes improve, patients with femoroacetabular impingement syndrome do not increase their objectively measured sport and physical activity level 1 year after hip arthroscopic surgery. Results from the HAFAI cohort:"
1969,Detection of Swallow Kinematic Events From Acoustic High-Resolution Cervical Auscultation Signals in Patients With Stroke:
1970,Deterioration of patellofemoral cartilage status after medial open-wedge high tibial osteotomy:
1971,Determinants and Variations of Hospital Costs in Patients with Lumbar Radiculopathy Hospitalized for Spinal Surgery:
1972,Determinants of anxiety in elite athletes: a systematic review and meta-analysis:
1973,Determinants of intention to disclose concussion symptoms in a population of U.S. military cadets:
1974,Determinants of non-profit sports clubs’ perceived competition from commercial sports providers:
1975,Determinants of Patient Satisfaction 2 Years After Spinal Deformity Surgery: A Latent Class Analysis:
1976,Determinants of Return to Work After Multicomponent Cardiac Rehabilitation:
1977,Determinants of skeletal muscle oxygen consumption assessed by near-infrared diffuse correlation spectroscopy during incremental handgrip exercise:
1978,"Determinants of Social Participation at 1, 3, and 6 Months Poststroke in Benin:"
1979,Determinants of sustainability of ski resorts: do size and altitude matter?:
1980,Determination and validation of peak fat oxidation in endurance-trained men using an upper body graded exercise test:
1981,Determination of normal KOOS and WOMAC values in a healthy population:
1982,Determination of peak cardiorespiratory fitness parameters in children: which averaging method should we use?:
1983,"Determination of Threshold Scores for Treatment Success After Arthroscopic Rotator Cuff Repair Using Oxford, Constant, and University of California, Los Angeles Shoulder Scores:"
1984,Determining a Resting Metabolic Rate Prediction Equation for Collegiate Female Athletes:
1985,Determining outcome in children and adolescents after concussion: Viewing things more holistically:
1986,"Determining Pressure Injury Risk on Admission to Inpatient Spinal Cord Injury Rehabilitation: A Comparison of the FIM, Spinal Cord Injury Pressure Ulcer Scale, and Braden Scale:"
1987,Determining the Corticospinal Responses to Single Bouts of Skill and Strength Training:
1988,Determining the Efficacy of the Chin-Down Maneuver Following Esophagectomy With Fiberoptic Endoscopic Evaluation of Swallowing:
1989,Determining the Generalizability of the PROMIS Depression Domain's Floor Effect and Completion Time in Patients Undergoing Orthopaedic Surgery:
1990,Determining the relationship between internal load markers and noncontact injuries in young elite soccer players:
1991,Determining the Upper Limit of the Metabolic Steady State:
1992,Detraining effect on overweight/obese women after high-intensity interval training in hypoxia:
1993,Detrended fluctuation analysis detects altered coordination of running gait in athletes following a heavy period of training:
1994,Developing a Barriers Scale in the Context of Travel: TRIP:
1995,Developing a standardized approach to virtual clinic follow-up of hip and knee arthroplasty:
1996,Developing athlete monitoring systems in team sports: Data analysis and visualization:
1997,Developing common demographic data elements to include in future editions of the SCAT and Child SCAT: A modified international Delphi study:
1998,Developing more effective seizure therapies requires more selective drugs:
1999,Developing team resilience: A season-long study of psychosocial enablers and strategies in a high-level sports team:
2000,Development and characterization of a novel bipedal standing mouse model of intervertebral disc and facet joint degeneration:
2001,Development and Implementation of a Wheelchair Outcomes Registry:
2002,Development and preliminary validation of the Communal Coping Strategies Inventory for Competitive Team Sports:
2003,Development and Testing of an Integrated Score for Physical Behaviors:
2004,Development and validation of a new elbow-specific scoring system for patients with elbow stiffness: the Shanghai Elbow Dysfunction Score:
2005,Development and Validation of a Novel Survival Prediction Model in Patients With Spinal Metastasis From Non-small Cell Lung Cancer:
2006,Development and Validation of a Questionnaire to Assess Barriers to Physical Activity After Stroke: The Barriers to Physical Activity After Stroke Scale:
2007,Development and Validation of a Scale to Measure Fear of Activity in Patients With Coronary Artery Disease (Fact-CAD):
2008,Development and validation of the metacognitive processes during Performances Questionnaire:
2009,Development of 11- to 16-year-olds’ short-term power output determined using both treadmill running and cycle ergometry:
2010,Development of a clinical risk calculator for prolonged opioid use after shoulder surgery:
2011,Development of a Computerized Adaptive Testing System for Assessing 5 Functions in Patients with Stroke: A Simulation and Validation Study:
2012,"Development of a gold-standard method for the identification of sedentary, light and moderate physical activities in older adults: Definitions for video annotation:"
2013,Development of a Modified Cervical Deformity Frailty Index: A Streamlined Clinical Tool for Preoperative Risk Stratification:
2014,Development of a return to play checklist following patellar instability surgery: a Delphi-based consensus:
2015,Development of an Institutional Opioid Prescriber Education Program and Opioid-Prescribing Guidelines: Impact on Prescribing Practices:
2016,Development of an on-water graded exercise test for flat-water sprint kayak athletes:
2017,Development of Deployable Predictive Models for Minimal Clinically Important Difference Achievement Across the Commonly Used Health-related Quality of Life Instruments in Adult Spinal Deformity Surgery:
2018,Development of peak oxygen uptake from 11–16 years determined using both treadmill and cycle ergometry:
2019,Development of physical fitness performance in young Swiss men from 2006 to 2015:
2020,"Development of Squat-and-Smile Test as Proxy for Femoral Shaft Fracture-Healing in Patients in Dar es Salaam, Tanzania:"
2021,Development of the glenohumeral joint after subscapular release and open relocation in children with brachial plexus birth palsy: long-term results in 61 patients:
2022,Development of the Measure of Experiential Aspects of Participation for People With Physical Disabilities:
2023,Development of the University of Wisconsin running injury and recovery index:
2024,Developmental activities and perceptions of challenge for National and Varsity women soccer players in Canada:
2025,Developmental maturation of activity-induced K + and pH transients and the associated extracellular space dynamics in the rat hippocampus:
2026,Developmental relations between motivation types and physical activity in elementary school children:
2027,Deviations in femoral joint lines using calipered kinematically aligned TKA from virtually planned joint lines are small and do not affect clinical outcomes:
2028,Device-guided slow breathing reduces blood pressure and sympathetic activity in young normotensive individuals of both sexes:
2029,Dexmedetomidine combined with interscalene brachial plexus block has a synergistic effect on relieving postoperative pain after arthroscopic rotator cuff repair:
2030,Dexmedetomidine preconditioning ameliorates inflammation and blood-spinal cord barrier damage after spinal cord ischemia-reperfusion injury by down-regulation high mobility group box 1-Toll-like receptor 4-nuclear factor ?b signaling pathway:
2031,Dha supplementation during prenatal ethanol exposure alters the expression of fetal rat liver genes involved in oxidative stress regulation:
2032,Diabetes disease severity was not associated with risk of deep infection or revision after shoulder arthroplasty:
2033,"Diagnosis, prevention and treatment of common lower extremity muscle injuries in sport-grading the evidence: A statement paper commissioned by the Danish Society of Sports Physical Therapy (DSSF):"
2034,Diagnostic accuracy of alpha-defensin enzyme-linked immunosorbent assay in the clinical evaluation of painful hip and knee arthroplasty with possible prosthetic joint infection: A prospective study of 202 cases:
2035,Diagnostic accuracy of clinical tests directed to the long head of biceps tendon in a surgical population: a combination of old and new tests:
2036,Diagnostic Accuracy of Sensory Clinical Findings of the Hand Dorsum and of Neurography of the Dorsal Ulnar Cutaneous Nerve in Ulnar Neuropathy at the Elbow:
2037,"Diagnostic Accuracy of Serum, Synovial, and Tissue Testing for Chronic Periprosthetic Joint Infection after Hip and Knee Replacements: A Systematic Review:"
2038,Diagnostic Arthroscopy for Detection of Periprosthetic Infection in Painful Shoulder Arthroplasty:
2039,Diagnostic Performance of Magnetic Resonance Imaging for Detecting Meniscal Ramp Lesions in Patients With Anterior Cruciate Ligament Tears: A Systematic Review and Meta-analysis:
2040,Diagnostic utility of fluorodeoxyglucose positron emission tomography in prosthetic joint infection based on MSIS criteria:
2041,Diagnostic Value of Clinical Tests for Infraspinatus Tendon Tears:
2042,Diagnostic Value of Stress Radiography and Arthrometer Measurement for Anterior Instability in Anterior Cruciate Ligament Injured Knees at Different Knee Flexion Position:
2043,Dialysis dependence and modality impact complication rates after shoulder arthroplasty:
2044,Diaphragm fatigue and inspiratory muscle metaboreflex in men and women matched for absolute diaphragmatic work during pressure-threshold loading:
2045,Diaphragm muscle function following midcervical contusion injury in rats:
2046,Did Clarification of Medicare Guidelines Change Outpatient Physical Therapy and Occupational Therapy Usage? A Retrospective Analysis:
2047,Did London 2012 deliver a sports participation legacy?:
2048,Diet quality and risk factors for cardiovascular disease among South Asians in Alberta:
2049,Dietary intakes of professional Australian football league women's (AFLW) athletes during a preseason training week:
2050,Dietary nitrate supplementation enhances cerebrovascular CO2 reactivity in a sex-specific manner:
2051,Difference in joint line convergence angle between the supine and standing positions is the most important predictive factor of coronal correction error after medial opening wedge high tibial osteotomy:
2052,Differences between Bimodal and Unimodal Force-time Curves during Countermovement Jump:
2053,Differences in case mix and outcomes between Swiss and Scottish total knee arthroplasty patients:
2054,Differences in determinants of aerobic and muscle strengthening physical activity among college students: a reasoned action approach:
2055,Differences in Femoral Torsion among Various Measurement Methods Increase in Hips with Excessive Femoral Torsion:
2056,Differences in foot muscle morphology and foot kinematics between symptomatic and asymptomatic pronated feet:
2057,Differences in Glucose Metabolism Among Women With Spinal Cord Injury May Not Be Fully Explained by Variations in Body Composition:
2058,Differences in Hip and Knee Landing Moments across Female Pubertal Development:
2059,Differences in Length of Stay and Costs Between Comparable Hospitalizations of Patients With Spina Bifida With or Without Pressure Injuries:
2060,Differences in linea alba stiffness and linea alba distortion between women with and without diastasis recti abdominis: The impact of measurement site and task:
2061,Differences in lower-limb coordination and coordination variability between novice and experienced runners during a prolonged treadmill run at anaerobic threshold speed:
2062,"Differences in maturity, morphological and physical attributes between players selected to the primary and secondary teams of a Portuguese Basketball elite academy:"
2063,Differences in micro-RNA expression profile between vastus lateralis samples and myotubes in COPD cachexia:
2064,Differences in sprint mechanical force–velocity profile between trained soccer and futsal players:
2065,Differences in strength performance between novice and elite athletes: Evidence from powerlifters:
2066,Differences in the Movement Skills and Physical Qualities of Elite Senior and Academy Rugby League Players:
2067,Differences in trunk and upper extremity kinematics and segmental velocities during the offside forehand polo swing between male and female athletes:
2068,Differences in v o peak of Surfers When Paddling in Water vs. on a Swimbench Ergometer:
2069,"Different cluster sets result in similar metabolic, endocrine, and perceptual responses in trained men:"
2070,"Different contributions from lungs and chest wall to respiratory mechanics in mice, rats, and rabbits:"
2071,Different femoral rotation with navigated flexion-gap balanced or measured resection in total knee arthroplasty does not lead to different clinical outcomes:
2072,Different neuromuscular parameters influence dynamic balance in male and female football players:
2073,"Different paths, same destination: divergent action potential responses produce conserved cardiac fight-or-flight response in mouse and rabbit hearts:"
2074,Different visual stimuli affect muscle activation at the knee during sidestepping:
2075,Differential activation of the calpain system involved in individualized adaptation of different fast-twitch muscles in hibernating Daurian ground squirrels:
2076,Differential effects of anaesthesia on the contractility of lymphatic vessels in vivo:
