Number,Title
3760,Indications for a single-stage exchange arthroplasty for chronic prosthetic joint infection: A systematic review:
3761,Indications for Arthroscopic Subacromial Decompression. A Level V Evidence Clinical Guideline:
3762,Indigenous Australian women promoting health through sport:
3763,Indirect Cost of Traumatic Brachial Plexus Injuries in the United States:
3764,Indirect Decompression on MRI Chronologically Progresses after Immediate Postlateral Lumbar Interbody Fusion: The Results from a Minimum of 2 Years Follow-Up:
3765,Individual and Combined Effect of Inter-repetition Rest and Elastic Bands on Jumping Potentiation in Resistance-Trained Men:
3766,Individual factors affecting rugby sevens match performance:
3767,Individual flexion stiffness of ski boots:
3768,Individual Muscle Hypertrophy and Strength Responses to High vs. Low Resistance Training Frequencies:
3769,Individual Patient-reported Activity Levels before and after Joint Arthroplasty Are Neither Accurate nor Reproducible:
3770,Individual Region- and Muscle-specific Hamstring Activity at Different Running Speeds:
3771,Individual Variability in Waist Circumference and Body Weight in Response to Exercise:
3772,Individual variations in steps per day for meeting physical activity guidelines in young adult women:
3773,Individualized sleep education improves subjective and objective sleep indices in elite cricket athletes: A pilot study:
3774,Individuals have unique muscle activation signatures as revealed during gait and pedaling:
3775,Individuals with and without low back pain use different motor control strategies to achieve spinal stiffness during the prone instability test:
3776,Induced in vivo knockdown of the Brca1 gene in skeletal muscle results in skeletal muscle weakness:
3777,Induced pluripotent stem cell-derived endothelial cells attenuate lipopolysaccharide-induced acute lung injury:
3778,Inducible nitric oxide synthase-derived nitric oxide reduces vagal satiety signalling in obese mice:
3779,Industry payments to authors of Journal of Shoulder and Elbow Surgery shoulder arthroplasty manuscripts are accurately disclosed by most authors and are not significantly associated with better reported treatment outcomes:
3780,"Inert gas narcosis in scuba diving, different gases different reactions:"
3781,In-exercise vascular shear rate during acute continuous and interval exercise: Impact on endothelial function and miR-21:
3782,Infantile Supracondylar Humeral Fractures (Patients Less Than Two Years of Age): Twice as Common in Females and a High Rate of Malunion with Lateral Column-Only Fixation:
3783,Infection after Unicompartmental Knee Arthroplasty: A High Risk of Subsequent Complications:
3784,Inferior graft maturity in the PL bundle after autograft hamstring double-bundle ACL reconstruction:
3785,Inferior outcomes and higher complication rates after shoulder arthroplasty in workers' compensation patients:
3786,Inflammatory cytokines and matrix metalloproteinases in the synovial fluid after intra-articular elbow fracture:
3787,Inflammatory features of obesity and smoke exposure and the immunologic effects of exercise:
3788,Influence of a multistrain probiotic on body composition and mood in female occupational shift workers:
3789,Influence of Acetabular Labral Tear Length on Outcomes After Hip Arthroscopy for Femoroacetabular Impingement Syndrome With Capsular Plication:
3790,Influence of advanced glycation end products on rotator cuff:
3791,Influence of Baseline Magnetic Resonance Imaging Features on Outcome of Arthroscopic Meniscectomy and Physical Therapy Treatment of Meniscal Tears in Osteoarthritis:
3792,"Influence of between-limb asymmetry in muscle mass, strength, and power on functional capacity in healthy older adults:"
3793,"Influence of Biological Maturity on the Match Performance of 8- to 16-Year-Old, Elite, Male, Youth Soccer Players:"
3794,Influence of Cigarette Smoking at the Time of Surgery on Postoperative Outcomes in Patients With Femoroacetabular Impingement: A Matched-Pair Cohort Analysis:
3795,Influence of dietary inorganic nitrate on blood pressure and vascular function in hypertension: Prospective implications for adjunctive treatment:
3796,Influence of environmental conditions on performance and heart rate responses to the 30-15 incremental fitness test in rugby union athletes:
3797,Influence of exercise amount and intensity on long-term weight loss maintenance and skeletal muscle mitochondrial ros production in humans:
3798,Influence of exercise time of day on salivary melatonin responses:
3799,Influence of Foam Rolling on Recovery From Exercise-Induced Muscle Damage:
3800,Influence of Graft Source on Postoperative Activity and Joint Laxity in Posterior Cruciate Ligament Reconstruction: A Systematic Review:
3801,Influence of humeral abduction angle on axial rotation and contact area at the glenohumeral joint:
3802,Influence of Medial Meniscus Bucket-Handle Repair in Setting of Anterior Cruciate Ligament Reconstruction on Tibiofemoral Contact Mechanics: A Biomechanical Study:
3803,Influence of Morphology and Strength on Front Crawl Swimming Speed in Junior and Youth Age-Group Swimmers:
3804,Influence of nasal CPAP on cardiorespiratory control in healthy neonate:
3805,Influence of Night Soccer Matches on Sleep in Elite Players:
3806,Influence of Peer-led Wheelchair Training on Wheelchair Skills and Participation in Older Adults: Clinical Outcomes of a Randomized Controlled Feasibility Trial:
3807,Influence of physical characteristics and match outcome on technical errors during rugby league match play:
3808,Influence of Power Clean Ability and Training Age on Adaptations to Weightlifting-Style Training:
3809,Influence of preoperative opioid use on postoperative outcomes and opioid use after arthroscopic rotator cuff repair:
3810,Influence of priming exercise on oxygen uptake and muscle deoxygenation kinetics during moderate-intensity cycling in type 2 diabetes:
3811,Influence of Reactive and Maximum Strength Indicators on Sprint Performance:
3812,Influence of Risky Pathoanatomy and Demographic Factors on Clinical Outcomes After Isolated Medial Patellofemoral Ligament Reconstruction: A Regression Analysis:
3813,"Influence of Sex, Menstrual Cycle, and Menopause Status on the Exercise Pressor Reflex:"
3814,"Influence of Smoking on the Expression of Genes and Proteins Related to Fat Infiltration, Inflammation, and Fibrosis in the Rotator Cuff Muscles of Patients With Chronic Rotator Cuff Tears: A Pilot Study:"
3815,Influence of Sutures on Cartilage Integrity: Do Meniscus Sutures Harm Cartilage? An Experimental Animal Study:
3816,"Influence of Test Environment, Age, Sex, and Sport on Baseline Computerized Neurocognitive Test Performance:"
3817,"Influence of the ""slingshot"" bench press training aid on bench press kinematics and neuromuscular activity in competitive powerlifters:"
3818,Influence of the composition of artificial turf on rotational traction and athlete biomechanics:
3819,"Influence of training models at 3,900-m altitude on the physiological response and performance of a professional wheelchair athlete: A case study:"
3820,Influence of wheel rim width on rolling resistance and off-road speed in cross-country mountain biking:
3821,"Informational constraints, option generation, and anticipation:"
3822,Informed consent in spinal surgery:
3823,Ingesting a bitter solution: The sweet touch to increasing short-term cycling performance:
3824,Inhibition of non-receptor tyrosine kinase Src induces phosphoserine 256-independent aquaporin-2 membrane accumulation:
3825,In-hospital mortality after hip arthroplasty in China: Analysis of a large national database:
3826,Initial maximum push-rim propulsion and sprint performance in elite wheelchair rugby players:
3827,Initial Provider Specialty Is Associated with Long-term Opiate Use in Patients with Newly Diagnosed Low Back and Lower Extremity Pain:
3828,Injection with autologous conditioned serum has better clinical results than eccentric training for chronic Achilles tendinopathy:
3829,Injections Prior to Rotator Cuff Repair Are Associated With Increased Rotator Cuff Revision Rates:
3830,Injective mesenchymal stem cell-based treatments for knee osteoarthritis: from mechanisms of action to current clinical evidences:
3831,Injuries among children and adults in alpine skiing and snowboarding:
3832,Injuries in male and female elite Korean wrestling athletes: A 10-year epidemiological study:
3833,Injury burden differs considerably between single teams from German professional male football (soccer): surveillance of three consecutive seasons:
3834,Injury epidemiology and risk factors in competitive artistic gymnasts: A systematic review:
3835,Injury in teenage Gaelic games:
3836,Injury incidence in semi-professional football claims for increased need of injury prevention in elite junior football:
3837,"Injury Incidence, Prevalence and Severity in High-Level Male Youth Football: A Systematic Review:"
3838,Injury prevention strategies specific to pre-elite athletes competing in Olympic and professional sports — A systematic review:
3839,Injury prevention training in football: Let's bring it to the real world:
3840,Injury profiles in elite women's T20 cricket:
3841,Injury rate and prevention in elite football: Let us first search within our own hearts:
3842,"Injury rates and characteristics in recreational, elite student and professional dancers: A systematic review:"
3843,Injury Surveillance in Major League Soccer: A 4-Year Comparison of Injury on Natural Grass Versus Artificial Turf Field:
3844,Innovation in shoulder surgery: the impact on our patients:
3845,In-Office Needle Arthroscopy: A Systematic Review of Indications and Clinical Utility:
3846,Inorganic nitrate supplementation and exercise. Is skeletal muscle involved in the heavy lifting?:
3847,"Inorganic phosphate, protons and diprotonated phosphate may contribute to the exacerbated muscle fatigue in older adults:"
3848,Inpatient Pain Scores and Narcotic Utilization Based on American Society of Anesthesiologists Score Following Anterior Cervical Discectomy and Fusion:
3849,Inpatient Rehabilitation Quality of Care From the Patient's Perspective: Effect of Data Collection Timing and Patient Characteristics:
3850,Insall–Salvati ratio stabilizes one year after mobile-bearing total knee arthroplasty and does not correlate with mid-to-long-term clinical outcomes:
3851,In-season adaptations to intense intermittent training and sprint interval training in sub-elite football players:
3852,Insert catchy title here: Engaging readers and improving health with stylish academic editorials:
3853,Insertional anatomy of the anterior medial collateral ligament on the sublime tubercle of the elbow:
3854,Insights into the pulmonary vascular complications of heart failure with preserved ejection fraction:
3855,Inspiratory muscle activation via ventral lower thoracic high-frequency spinal cord stimulation:
3856,Inspiratory muscle training effects on oxygen saturation and performance in hypoxemic rowers: Effect of sex:
3857,Inspiratory muscle training: Improvement of exercise performance with acute hypoxic exposure:
3858,Inspiratory pressure-generating capacity is preserved during ventilatory and non-ventilatory behaviours in young dystrophic mdx mice despite profound diaphragm muscle weakness:
3859,Instability severity index score values below 7 do not predict recurrence after arthroscopic Bankart repair:
3860,Institutional Guidelines for Resistance Exercise Training in Cardiovascular Disease: A Systematic Review:
3861,Instrument-assisted soft tissue mobilization: A systematic review and effect-size analysis:
3862,Instruments Measuring Physical Activity in Individuals Who Use a Wheelchair: A Systematic Review of Measurement Properties:
3863,Insufficient consensus regarding circle size and bone loss width using the ratio—“best fit circle”—method even with three-dimensional computed tomography:
3864,"Insulin at the Crossroads of Metabolic, Neurologic, and Vasculature Disease:"
3865,Insulin Dependence Is Associated With Increased Medical Complications and Mortality After Shoulder Arthroscopy:
3866,Insulin potentiates the response to mechanical stimuli in small dorsal root ganglion neurons and thin fibre muscle afferents in vitro:
3867,"Intact single muscle fibres from SOD1G93A amyotrophic lateral sclerosis mice display preserved specific force, fatigue resistance and training-like adaptations:"
3868,Intensity and load characteristics of professional road cycling: Differences between men’s and women’s races:
3869,Intensity and workload related dose-response effects of acute resistance exercise on domain-specific cognitive function and affective response – A four-armed randomized controlled crossover trial:
3870,Intensity of acute aerobic exercise but not aerobic fitness impacts on corticospinal excitability:
3871,Intensive In-Hospital Rehabilitation After Hip Fracture Surgery and Activities of Daily Living in Patients With Dementia: Retrospective Analysis of a Nationwide Inpatient Database:
3872,Inter- and Intra-rater Reliability of the Athletic Ability Assessment in Subelite Australian Rules Football Players:
3873,Inter- and intra-rater reliability of ultrasound tissue characterization (UTC) in patellar tendons:
3874,Interaction between graviception and carotid baroreflex function in humans during parabolic flight-induced microgravity:
3875,Interaction between the respiratory system and cerebral blood flow regulation:
3876,Interactions between fascicles and tendinous tissues in gastrocnemius medialis and vastus lateralis during drop landing:
3877,Interactive Virtual Reality Reduces Quadriceps Pain during High-Intensity Cycling:
3878,Intercellular Ca 2+ signalling in the adult mouse cochlea:
3879,Intercellular calcium waves integrate hormonal control of glucose output in the intact liver:
3880,Interday reliability and usefulness of a reactive strength index derived from 2 maximal rebound jump tests:
3881,Inter-individual differences in stride frequencies during running obtained from wearable data:
3882,Interleukin-1 receptor accessory proteins are required for normal homeostatic responses to sleep deprivation:
3883,Interleukin-15 as a myokine: Mechanistic insight into its effect on skeletal muscle metabolism:
3884,Intermittent but Not Continuous Static Stretching Improves Subsequent Vertical Jump Performance in Flexibility-Trained Athletes:
3885,Intermittent Cooling During Judo Training in a Warm/Humid Environment Reduces Autonomic and Hormonal Impact:
3886,Intermittent exercise-heat exposures and intense physical activity sustain heat acclimation adaptations:
3887,Intermittent hypoxia impairs uterine artery function in pregnant mice:
3888,Intermittent hypoxia: friend or foe?:
3889,Intermittent sequential pneumatic compression does not enhance whole-body heat loss in elderly adults during extreme heat exposure:
3890,Intermittent sprint performance in the heat is not altered by augmenting thermal perception via L-menthol or capsaicin mouth rinses:
3891,Internal and external training load: 15 years on:
3892,Internal consistency and validity of measures of automatic exercise associations:
3893,Internal rotation of the tibial component in total knee arthroplasty can lead to extension deficit:
3894,International consensus definitions of video signs of concussion in professional sports:
3895,International Expert Consensus on a Cell Therapy Communication Tool: DOSES:
3896,International perspectives are important:
3897,Interneuron NMDA receptors change the gear of motor learning in the cerebellar machine:
3898,Interneuronal NMDA receptors regulate long-term depression and motor learning in the cerebellum:
3899,Interorganisational conflict between national and provincial sport organisations within China's elite sport system: Perspectives from national organisations:
3900,"Interplay between diet, exercise and the molecular circadian clock in orchestrating metabolic adaptations of adipose tissue:"
3901,Interpreting and reporting fracture classification and operation type in hip fracture: Implications for research studies and routine national audits:
3902,Interpreting outcomes 2-Statistical significance and clinical meaningfulness: Linking evidence to practice:
3903,Interpreting outcomes 3-clinical meaningfulness: Linking evidence to practice:
3904,Interrater Reliability of Activity Questionnaires After an Intensive Motor-Skill Learning Intervention for Children With Cerebral Palsy:
3905,Interrelationships between pulse arrival time and arterial blood pressure during postural transitions before and after spaceflight:
3906,"Intersection of catastrophizing, gender, and disease severity in preoperative rotator cuff surgical patients: a cross-sectional study:"
3907,Interset Stretching vs. Traditional Strength Training: Effects on Muscle Strength and Size in Untrained Individuals:
3908,Interunit reliability and effect of data-processing methods of global positioning systems:
3909,Interventions for displaced radial head fractures: network meta-analysis of randomized trials:
3910,Intimate Partner Violence and Orthopaedics: AOA Critical Issues:
3911,Intra- and Interrater Reliability and Concurrent Validity of a New Tool for Assessment of Breast Cancer–Related Lymphedema of the Upper Extremity:
3912,Intra-articular Injection of Chloramphenicol Reduces Articular Cartilage Degeneration in a Rabbit Model of Osteoarthritis:
3913,"Intra-articular injection of culture-expanded mesenchymal stem cells with or without addition of platelet-rich plasma is effective in decreasing pain and symptoms in knee osteoarthritis: a controlled, double-blind clinical trial:"
3914,Intra-articular Injection of Culture-Expanded Mesenchymal Stem Cells Without Adjuvant Surgery in Knee Osteoarthritis: A Systematic Review and Meta-analysis:
3915,"Intra-articular Injection of Platelet-Rich Plasma Is Superior to Hyaluronic Acid or Saline Solution in the Treatment of Mild to Moderate Knee Osteoarthritis: A Randomized, Double-Blind, Triple-Parallel, Placebo-Controlled Clinical Trial:"
3916,Intra-articular injection of steroids in the early postoperative period does not have an adverse effect on the clinical outcomes and the re-tear rate after arthroscopic rotator cuff repair:
3917,Intra-articular Injection of Tranexamic Acid Reduced Postoperative Hemarthrosis in Arthroscopic Anterior Cruciate Ligament Reconstruction: A Prospective Randomized Study:
3918,Intra-articular Mesenchymal Stem Cells in Osteoarthritis of the Knee: A Systematic Review of Clinical Outcomes and Evidence of Cartilage Repair:
3919,Intra-articular Volume Reduction With Arthroscopic Plication for Capsular Laxity of the Hip: A Cadaveric Comparison of Two Surgical Techniques:
3920,Intracellular calcium stores mediate metaplasticity at hippocampal dendritic spines:
3921,Intradialytic Resistance Training Improves Functional Capacity and Lean Mass Gain in Individuals on Hemodialysis: A Randomized Pilot Trial:
3922,Intramuscular fibre conduction velocity and muscle fascicle length in human vastus lateralis:
3923,Intraobserver and interobserver reliability of the modified Walch classification using radiographs and computed tomography:
3924,Intraoperative and anatomic dimensions of the coracoid graft as they pertain to the Latarjet-Walch procedure:
3925,Intraoperative graft-related complications are a risk factor for recurrence in arthroscopic Latarjet stabilisation:
3926,Intraoperative mobile-bearing movement in Oxford unicompartmental knee arthroplasty:
3927,Intraoperative monitoring of the femoral and sciatic nerves in total hip arthroplasty with high-riding developmental dysplasia:
3928,Intraoperative neuromonitoring (IONM): Is there a role in metastatic spine tumor surgery?:
3929,Intraoperative neuromonitoring during reverse shoulder arthroplasty:
3930,Intraoperative posterior movement of the tibia at 90° of flexion predicts worse postoperative flexion angles in cruciate-substituting total knee arthroplasty:
3931,"Intra-pulmonary arteriovenous anastomoses and pulmonary gas exchange: evaluation by microspheres, contrast echocardiography and inert gas elimination:"
3932,Intra-seasonal variation of injury patterns among German Bundesliga soccer players:
3933,Intrasession and Intersession Reliability of Countermovement Jump Testing in Division-I Volleyball Athletes:
3934,Intrathecal Baclofen Trial Before Device Implantation: 12-Year Experience With Continuous Administration:
3935,"Intravenous Administration of Tranexamic Acid Significantly Improved Clarity of the Visual Field in Arthroscopic Shoulder Surgery. A Prospective, Double-Blind, and Randomized Controlled Trial:"
3936,Intravenous and Oral Tranexamic Acid Are Equivalent at Reducing Blood Loss in Thoracolumbar Spinal Fusion: A Prospective Randomized Trial:
3937,Intravenous fluids and their use in sport: A position statement from the Australian Institute of Sport:
3938,Intravenous tranexamic acid safely and effectively reduces transfusion rates in revision total hip arthroplasty:
3939,Intrawound antibiotic powder decreases frequency of deep infection and severity of heterotopic ossification in combat lower extremity amputations:
3940,Intrawound vancomycin powder increases post-operative wound complications and does not decrease periprosthetic joint infection in primary total and unicompartmental knee arthroplasties:
3941,Intrinsic foot muscles contribute to elastic energy storage and return in the human foot:
3942,Introducing horizons:
3943,Introducing the hip society and the knee society:
3944,Introducing the Lateral Femoral Condyle Index as a Risk Factor for Anterior Cruciate Ligament Injury:
3945,Introduction to this special issue:
3946,Inverse association between changes in energetic cost of walking and vertical accelerations in non-metastatic breast cancer survivors:
3947,"Investigating ""A Consensus of Uninformed Dogma"": C.H. McCloy and Strength Training Research at the University of Iowa in the Mid-Twentieth Century:"
3948,"Investigating a dose–response relationship between high-fat diet consumption and the contractile performance of isolated mouse soleus, EDL and diaphragm muscles:"
3949,Investigating Characteristics of Quality Peer Mentors With Spinal Cord Injury:
3950,Investigating circadian clock gene expression in human tendon biopsies from acute exercise and immobilization studies:
3951,Investigating the construct of motor competence in middle childhood using the BOT-2 Short Form: An item response theory perspective:
3952,Investigation of a New Couples Intervention for Individuals With Brain Injury: A Randomized Controlled Trial:
3953,Involvement of the epithelial sodium channel in initiation of mechanically evoked swallows in anaesthetized rats:
3954,Involving research-invested clinicians in data collection affects injury incidence in youth football:
3955,Ion channels: the concept emerges:
3956,Ionic signalling in astroglia beyond calcium:
3957,Ionotropic and metabotropic kainate receptor signalling regulates Cl ? homeostasis and GABAergic inhibition:
3958,"Iontophoresis in lateral epicondylitis: a randomized, double-blind clinical trial:"
3959,Ipsilateral elbow and shoulder dislocation: a case report:
3960,Iron considerations for the athlete: a narrative review:
3961,Iron insufficiency diminishes the erythropoietic response to moderate altitude exposure:
3962,Irritable bowel syndrome is underdiagnosed and ineffectively managed among endurance athletes:
3963,Is “school sport” associated with school belongingness? Testing the influence of school sport policy:
3964,Is a 12-h Nitrox dive hazardous for pulmonary function?:
3965,"Is a modular dual mobility acetabulum a viable option for the young, active total hip arthroplasty patient?:"
3966,Is abdominal hypopressive technique effective in the prevention and treatment of pelvic floor dysfunction? Marketing or evidence from high-quality clinical trials?:
3967,Is Acromioplasty Ever Indicated During Rotator Cuff Repair?:
3968,Is an acetabular cage and cement fixation sufficiently durable for the treatment of destructive acetabular metastases?:
3969,Is bone loss or devascularization associated with recurrence of osteomyelitis in wartime open tibia fractures?:
3970,Is Bony Morphology and Morphometry Associated With Degenerative Full-Thickness Rotator Cuff Tears? A Systematic Review and Meta-analysis:
3971,"Is chronic ankle instability associated with impaired muscle strength? Ankle, knee and hip muscle strength in individuals with chronic ankle instability: A systematic review with meta-analysis:"
3972,Is Elective Soft Tissue Hand Surgery Associated with Periprosthetic Joint Infection after Total Joint Arthroplasty?:
3973,Is end-organ surveillance necessary in patients with well-functioning metal-on-metal hip resurfacings?:
3974,Is Fatigue a Risk Factor for Anterior Cruciate Ligament Rupture?:
3975,Is Fatigue Associated With Aerobic Capacity and Muscle Strength in People With Multiple Sclerosis: A Systematic Review and Meta-analysis:
3976,Is Heat Intolerance State or Trait?:
3977,Is Hip Arthroscopy Effective in Patients With Combined Excessive Femoral Anteversion and Borderline Dysplasia? A Match-Controlled Study:
3978,Is hip muscle strength normalised in patients with femoroacetabular impingement syndrome one year after surgery?: Results from the HAFAI cohort:
3979,Is Implant Coating with Tyrosol- and Antibiotic-loaded Hydrogel Effective in Reducing Cutibacterium (Propionibacterium) acnes Biofilm Formation? A Preliminary in Vitro Study:
